{
  "schema_version": "avicenna.criteria-pack/0.1",
  "pack_id": "NCT02979119@2025-09-16/trial-pack-builder-llm/1.0.0",
  "trial_id": "NCT02979119",
  "criteria_completeness": "partial",
  "generated_at": "2026-10-17T00:00:00Z",
  "arms": [
    {
      "arm_id": "main",
      "arm_name": "All participants",
      "study_type": "observational"
    }
  ],
  "criteria": [
    {
      "criterion_id": "inc:b0",
      "criterion_type": "inclusion",
      "hardness": "hard",
      "arm_scope": null,
      "source_text": "Diagnosed with Haemophilia A or B",
      "atoms": [],
      "completeness_note": "opaque_text"
    },
    {
      "criterion_id": "inc:b1",
      "criterion_type": "inclusion",
      "hardness": "hard",
      "arm_scope": null,
      "source_text": "Factor VIII/ IX activity of \\<1 to 25%",
      "atoms": [],
      "completeness_note": "opaque_text"
    },
    {
      "criterion_id": "inc:b2",
      "criterion_type": "inclusion",
      "hardness": "hard",
      "arm_scope": null,
      "source_text": "Complete records of Factor treatment and bleeds",
      "atoms": [],
      "completeness_note": "opaque_text"
    },
    {
      "criterion_id": "inc:b3",
      "criterion_type": "inclusion",
      "hardness": "hard",
      "arm_scope": null,
      "source_text": "Treated in one of the participating centres",
      "atoms": [],
      "completeness_note": "opaque_text"
    },
    {
      "criterion_id": "exc:b0",
      "criterion_type": "exclusion",
      "hardness": "hard",
      "arm_scope": null,
      "source_text": "Patients referred because of an inhibitor\\*",
      "atoms": [],
      "completeness_note": "opaque_text"
    },
    {
      "criterion_id": "exc:b1",
      "criterion_type": "exclusion",
      "hardness": "procedural_pre_screen",
      "arm_scope": null,
      "source_text": "Informed consent not obtained",
      "atoms": [],
      "completeness_note": "opaque_text"
    }
  ]
}
