{
  "schema_version": "avicenna.criteria-pack/0.1",
  "pack_id": "NCT04901936@2026-06-26/trial-pack-builder-llm/1.0.0",
  "trial_id": "NCT04901936",
  "criteria_completeness": "partial",
  "generated_at": "2026-10-17T00:00:00Z",
  "arms": [
    {
      "arm_id": "main",
      "arm_name": "All participants",
      "study_type": "interventional"
    }
  ],
  "criteria": [
    {
      "criterion_id": "inc:age-min",
      "criterion_type": "inclusion",
      "hardness": "hard",
      "arm_scope": null,
      "source_text": "Minimum age: 12.0 Years (registry structured field)",
      "atoms": [
        {
          "atom_id": "a",
          "predicate_type": "simple_comparison",
          "arm_scope": null,
          "source_text": "Age ≥ 12.0 years",
          "fact_key": "demographics.age",
          "comparator": "ge",
          "threshold": {
            "value": 12.0,
            "unit": "a"
          }
        }
      ],
      "completeness_note": "complete"
    },
    {
      "criterion_id": "inc:age-max",
      "criterion_type": "inclusion",
      "hardness": "hard",
      "arm_scope": null,
      "source_text": "Maximum age: 17.0 Years (registry structured field)",
      "atoms": [
        {
          "atom_id": "a",
          "predicate_type": "simple_comparison",
          "arm_scope": null,
          "source_text": "Age ≤ 17.0 years",
          "fact_key": "demographics.age",
          "comparator": "le",
          "threshold": {
            "value": 17.0,
            "unit": "a"
          }
        }
      ],
      "completeness_note": "complete"
    },
    {
      "criterion_id": "inc:b0",
      "criterion_type": "inclusion",
      "hardness": "hard",
      "arm_scope": null,
      "source_text": "Are 12-17 years old at the time of screening",
      "atoms": [],
      "completeness_note": "opaque_text"
    },
    {
      "criterion_id": "inc:b1",
      "criterion_type": "inclusion",
      "hardness": "hard",
      "arm_scope": null,
      "source_text": "Weigh at least 20 kg (approx. 44 lbs)",
      "atoms": [],
      "completeness_note": "opaque_text"
    },
    {
      "criterion_id": "inc:b2",
      "criterion_type": "inclusion",
      "hardness": "hard",
      "arm_scope": null,
      "source_text": "Have the diagnosis of PNH, confirmed by high-sensitivity flow cytometry (granulocyte or monocyte clone \\>10%)",
      "atoms": [],
      "completeness_note": "opaque_text"
    },
    {
      "criterion_id": "inc:b3",
      "criterion_type": "inclusion",
      "hardness": "hard",
      "arm_scope": null,
      "source_text": "EITHER: Not being treated with an approved complement inhibitor (eculizumab or ravulizumab) prior to start of pegcetacoplan dosing, AND have hemolytic anemia. Hemolytic anemia is defined as hemoglobin (Hb) less than the lower limit of normal (Hb \\< LLN) and LDH \\>1.5 times the upper limit of normal (ULN); OR Currently receiving treatment with an approved complement inhibitor (eculizumab or ravulizumab) AND have evidence of ongoing anemia. Ongoing anemia is defined as Hb \\< LLN and ARC \\> ULN",
      "atoms": [],
      "completeness_note": "opaque_text"
    },
    {
      "criterion_id": "inc:b4",
      "criterion_type": "inclusion",
      "hardness": "hard",
      "arm_scope": null,
      "source_text": "Have a platelet count \\>75,000/mm3 and an absolute neutrophil count \\>1000/mm3",
      "atoms": [],
      "completeness_note": "opaque_text"
    },
    {
      "criterion_id": "exc:b0",
      "criterion_type": "exclusion",
      "hardness": "hard",
      "arm_scope": null,
      "source_text": "Are an adult, 18 years of age or older, with PNH",
      "atoms": [],
      "completeness_note": "opaque_text"
    },
    {
      "criterion_id": "exc:b1",
      "criterion_type": "exclusion",
      "hardness": "hard",
      "arm_scope": null,
      "source_text": "Known or suspected hereditary fructose intolerance (HFI)",
      "atoms": [],
      "completeness_note": "opaque_text"
    },
    {
      "criterion_id": "exc:b2",
      "criterion_type": "exclusion",
      "hardness": "hard",
      "arm_scope": null,
      "source_text": "History of hereditary complement deficiency, bone marrow transplant, or meningococcal disease (meningitis, bacteremia or septicemia)",
      "atoms": [],
      "completeness_note": "opaque_text"
    },
    {
      "criterion_id": "exc:pregnant",
      "criterion_type": "exclusion",
      "hardness": "hard",
      "arm_scope": null,
      "source_text": "pregnant",
      "atoms": [
        {
          "atom_id": "a",
          "predicate_type": "simple_comparison",
          "arm_scope": null,
          "source_text": "pregnant",
          "fact_key": "safety.pregnant",
          "comparator": "eq",
          "threshold": true
        }
      ],
      "completeness_note": "complete"
    }
  ]
}
