{
  "schema_version": "avicenna.criteria-pack/0.1",
  "pack_id": "NCT03773965@2026-10-07/trial-pack-builder-llm/1.0.0",
  "trial_id": "NCT03773965",
  "criteria_completeness": "partial",
  "generated_at": "2026-10-17T00:00:00Z",
  "arms": [
    {
      "arm_id": "main",
      "arm_name": "All participants",
      "study_type": "interventional"
    }
  ],
  "criteria": [
    {
      "criterion_id": "inc:age-min",
      "criterion_type": "inclusion",
      "hardness": "hard",
      "arm_scope": null,
      "source_text": "Minimum age: 1.0 Years (registry structured field)",
      "atoms": [
        {
          "atom_id": "a",
          "predicate_type": "simple_comparison",
          "arm_scope": null,
          "source_text": "Age ≥ 1.0 years",
          "fact_key": "demographics.age",
          "comparator": "ge",
          "threshold": {
            "value": 1.0,
            "unit": "a"
          }
        }
      ],
      "completeness_note": "complete"
    },
    {
      "criterion_id": "inc:age-max",
      "criterion_type": "inclusion",
      "hardness": "hard",
      "arm_scope": null,
      "source_text": "Maximum age: 18.0 Years (registry structured field)",
      "atoms": [
        {
          "atom_id": "a",
          "predicate_type": "simple_comparison",
          "arm_scope": null,
          "source_text": "Age ≤ 18.0 years",
          "fact_key": "demographics.age",
          "comparator": "le",
          "threshold": {
            "value": 18.0,
            "unit": "a"
          }
        }
      ],
      "completeness_note": "complete"
    },
    {
      "criterion_id": "inc:b0",
      "criterion_type": "inclusion",
      "hardness": "hard",
      "arm_scope": null,
      "source_text": "Participants must have completed a previous study of baricitinib for the treatment of JIA.",
      "atoms": [],
      "completeness_note": "opaque_text"
    },
    {
      "criterion_id": "exc:b0",
      "criterion_type": "exclusion",
      "hardness": "hard",
      "arm_scope": null,
      "source_text": "Participants must not have had a permanent discontinuation of baricitinib in the prior study.",
      "atoms": [],
      "completeness_note": "opaque_text"
    },
    {
      "criterion_id": "exc:b1",
      "criterion_type": "exclusion",
      "hardness": "hard",
      "arm_scope": null,
      "source_text": "Participants must have not developed an allergy to baricitinib.",
      "atoms": [],
      "completeness_note": "opaque_text"
    }
  ]
}
