{
  "schema_version": "avicenna.criteria-pack/0.1",
  "pack_id": "NCT02834884@2026-06-24/trial-pack-builder-llm/1.0.0",
  "trial_id": "NCT02834884",
  "criteria_completeness": "partial",
  "generated_at": "2026-10-17T00:00:00Z",
  "arms": [
    {
      "arm_id": "main",
      "arm_name": "All participants",
      "study_type": "observational"
    }
  ],
  "criteria": [
    {
      "criterion_id": "inc:age-min",
      "criterion_type": "inclusion",
      "hardness": "hard",
      "arm_scope": null,
      "source_text": "Minimum age: 12.0 Years (registry structured field)",
      "atoms": [
        {
          "atom_id": "a",
          "predicate_type": "simple_comparison",
          "arm_scope": null,
          "source_text": "Age ≥ 12.0 years",
          "fact_key": "demographics.age",
          "comparator": "ge",
          "threshold": {
            "value": 12.0,
            "unit": "a"
          }
        }
      ],
      "completeness_note": "complete"
    },
    {
      "criterion_id": "inc:b0",
      "criterion_type": "inclusion",
      "hardness": "hard",
      "arm_scope": null,
      "source_text": "Patients with pathologically confirmed selected tumor types (at site or centrally);",
      "atoms": [],
      "completeness_note": "opaque_text"
    },
    {
      "criterion_id": "inc:b1",
      "criterion_type": "inclusion",
      "hardness": "hard",
      "arm_scope": null,
      "source_text": "Mandatory availability of adequate human biological material (HBM);",
      "atoms": [],
      "completeness_note": "opaque_text"
    },
    {
      "criterion_id": "inc:b2",
      "criterion_type": "inclusion",
      "hardness": "hard",
      "arm_scope": null,
      "source_text": "Centrally performed confirmation of HBM adequacy in terms of quality and quantity for SPECTA downstream project requirements;",
      "atoms": [],
      "completeness_note": "opaque_text"
    },
    {
      "criterion_id": "inc:b3",
      "criterion_type": "inclusion",
      "hardness": "hard",
      "arm_scope": null,
      "source_text": "Age ≥ 12 years;",
      "atoms": [],
      "completeness_note": "opaque_text"
    },
    {
      "criterion_id": "inc:b4",
      "criterion_type": "inclusion",
      "hardness": "hard",
      "arm_scope": null,
      "source_text": "Absence of any psychological, familial, sociological or geographical condition potentially hampering compliance with the study protocol and follow-up schedule;",
      "atoms": [],
      "completeness_note": "opaque_text"
    },
    {
      "criterion_id": "inc:b5",
      "criterion_type": "inclusion",
      "hardness": "procedural_pre_screen",
      "arm_scope": null,
      "source_text": "Written informed consent according to applicable legal and ethical requirements;",
      "atoms": [],
      "completeness_note": "opaque_text"
    }
  ]
}
