{
  "schema_version": "avicenna.criteria-pack/0.1",
  "pack_id": "NCT02812290@2026-05-28/trial-pack-builder-llm/1.0.0",
  "trial_id": "NCT02812290",
  "criteria_completeness": "partial",
  "generated_at": "2026-10-17T00:00:00Z",
  "arms": [
    {
      "arm_id": "main",
      "arm_name": "All participants",
      "study_type": "observational"
    }
  ],
  "criteria": [
    {
      "criterion_id": "inc:age-min",
      "criterion_type": "inclusion",
      "hardness": "hard",
      "arm_scope": null,
      "source_text": "Minimum age: 18.0 Years (registry structured field)",
      "atoms": [
        {
          "atom_id": "a",
          "predicate_type": "simple_comparison",
          "arm_scope": null,
          "source_text": "Age ≥ 18.0 years",
          "fact_key": "demographics.age",
          "comparator": "ge",
          "threshold": {
            "value": 18.0,
            "unit": "a"
          }
        }
      ],
      "completeness_note": "complete"
    },
    {
      "criterion_id": "inc:b0",
      "criterion_type": "inclusion",
      "hardness": "hard",
      "arm_scope": null,
      "source_text": "All lung transplant recipients undergoing a biopsy as determined by their surgeon or physician.",
      "atoms": [],
      "completeness_note": "opaque_text"
    },
    {
      "criterion_id": "exc:b0",
      "criterion_type": "exclusion",
      "hardness": "procedural_pre_screen",
      "arm_scope": null,
      "source_text": "Patients who declined participation or unable to give informed consent.",
      "atoms": [],
      "completeness_note": "opaque_text"
    }
  ]
}
